{
  "schema_version": "1.0.1",
  "元数据": {
    "输入": "第一章_第三扇门不能开.md",
    "输入类型": "单章",
    "提取端": "人工基准复核",
    "校准状态": "C0",
    "源文件SHA256": "7859595ebdefd57ea551870283590a23d0a58119351d5b0dbe2a81c8fe07c0fd"
  },
  "直接测量": {
    "正文汉字数": 2339,
    "自然段数": 205,
    "有效句子数": 216,
    "平均句长": 10.83,
    "句长变异系数": 0.6123,
    "8字以内短段占比": 0.4488,
    "主要事件节点": 12
  },
  "硬闸门": {
    "因果闸门": {
      "通过": true,
      "证据": [
        "钥匙—旧死亡记录—尸体消失—入口—追捕—主动进入形成可追溯链。"
      ],
      "判定": "关键结果均能追溯至前因与人物行动。"
    },
    "人物闸门": {
      "通过": true,
      "证据": [
        "“陆沉舟知道自己有两个选择。”"
      ],
      "判定": "进入门内由封锁、追捕、入口缩小和持钥匙共同触发。"
    },
    "连续性闸门": {
      "通过": true,
      "证据": [
        "黑钥匙从遗言、药叶反应、血液触发到开门持续继承。"
      ],
      "判定": "章内时间、地点、物品与规则未发现无法解释的硬冲突。"
    },
    "视角闸门": {
      "通过": true,
      "证据": [
        "“只有陆沉舟看见了。”"
      ],
      "判定": "信息限制于陆沉舟可见、可听和可推断范围。"
    }
  },
  "章级六维": {
    "理解成立度": {
      "分数": 3.45,
      "证据": [
        "“一个人死一次，是常理。死两次，就不是常理。”"
      ],
      "判定": "主要异常、威胁和选择清楚。"
    },
    "因果推进度": {
      "分数": 3.55,
      "证据": [
        "尸体消失后药地塌陷，黑钥匙响应灰雾入口。"
      ],
      "判定": "事件持续改变后续路径。"
    },
    "人物主动度": {
      "分数": 3.3,
      "证据": [
        "“或者，在门关上前进去。”"
      ],
      "判定": "主角在明确权衡后主动选择。"
    },
    "情绪成立度": {
      "分数": 3.0,
      "证据": [
        "“冷汗从下巴滴到石阶上。”"
      ],
      "判定": "压迫和逃亡通过身体与行动成立。"
    },
    "当章回报度": {
      "分数": 2.9,
      "证据": [
        "“他站在一座黑色山门前。”"
      ],
      "判定": "完成进门与新场景揭示，但正向收益有限。"
    },
    "后续牵引度": {
      "分数": 3.85,
      "证据": [
        "“第三扇门后，藏着青岚宗第一次灭门。”"
      ],
      "判定": "章末形成强烈且具体的下一步问题。"
    }
  },
  "文学表现": {
    "声音独特度": {
      "分数": 2.5,
      "证据": [
        "“字落得很平。木架上的死人却不平。”"
      ],
      "判定": "叙述声音明确，人物个人声纹仍可加强。"
    },
    "感知具体度": {
      "分数": 3.45,
      "证据": [
        "“掌心被碎砂划开，血一下渗出来。”",
        "疼痛沿肋骨、脊背、左腿钻开。"
      ],
      "判定": "感官与物质环境具体。"
    },
    "意义复层度": {
      "分数": 3.1,
      "证据": [
        "黑钥匙同时是遗物、门票、诱饵和身体记忆载体。"
      ],
      "判定": "核心符号承担多层叙事功能。"
    },
    "节律控制度": {
      "分数": 2.95,
      "证据": [
        "“一声。两声。三声。”在两个空间重复。"
      ],
      "判定": "节律有效，但短段手法出现偏密。"
    },
    "视角控制度": {
      "分数": 3.5,
      "证据": [
        "“宁小满也没有看见。只有陆沉舟看见了。”"
      ],
      "判定": "有限视角稳定。"
    },
    "表达陌生度": {
      "分数": 3.0,
      "证据": [
        "“血从长阶上往下流……又慢慢往回爬。”"
      ],
      "判定": "有辨识度意象，亦混有熟悉网文表达。"
    }
  },
  "AI味": {
    "模板重复": {
      "分数": 2.7,
      "证据": [
        "“不是木头响。是老人的指骨自己松开了。”",
        "“不是遗物。是门票。”"
      ],
      "判定": "同构反义句式重复。"
    },
    "句法均质": {
      "分数": 2.1,
      "证据": [
        "205个自然段中大量短段连续出现。"
      ],
      "判定": "句长有变化，但分段节拍趋同。"
    },
    "过度解释": {
      "分数": 1.7,
      "证据": [
        "“他们要活的。说明钥匙还不能离开他。说明……”"
      ],
      "判定": "局部推断被连续说满。"
    },
    "通用抽象": {
      "分数": 0.8,
      "证据": [
        "“这附近许多人怕他。”"
      ],
      "判定": "抽象表达较少，整体有具体锚点。"
    },
    "语义复述": {
      "分数": 1.85,
      "证据": [
        "“没有怒意。只有确定。像猎人终于看见猎物……”"
      ],
      "判定": "局部动作含义被再次解释。"
    },
    "套语过渡": {
      "分数": 0.8,
      "证据": [
        "“这一次更重。”"
      ],
      "判定": "常规过渡词使用不多。"
    }
  },
  "情节平滑化": {
    "因果连续性": {
      "分数": 3.7,
      "证据": [
        "黑钥匙、药叶、尸体消失、灰雾入口连续触发。"
      ],
      "判定": "因果链稳定。"
    },
    "目标连续性": {
      "分数": 3.55,
      "证据": [
        "主角从弄清遗物转为避免被活捉并进入门内。"
      ],
      "判定": "目标变化由局势推动。"
    },
    "状态继承连续性": {
      "分数": 3.75,
      "证据": [
        "钥匙温热、跳动、遇血发烫并最终开门。"
      ],
      "判定": "关键状态持续继承。"
    },
    "事件显著性差异": {
      "分数": 3.2,
      "证据": [
        "二次死亡、尸体消失、药地塌陷、灭门遗迹逐层升级。"
      ],
      "判定": "事件重要性有明显差异。"
    },
    "重新解释与意外": {
      "分数": 3.45,
      "证据": [
        "周不问并非普通遗体，钥匙也不是普通遗物。"
      ],
      "判定": "多次重写此前理解。"
    },
    "真实路径分叉": {
      "分数": 2.8,
      "证据": [
        "交出钥匙与进入门内带来不同后果，主角实际选择后者。"
      ],
      "判定": "选择具有非等价性。"
    },
    "节拍不规则度": {
      "分数": 3.0,
      "证据": [
        "停尸房调查、封锁追逐、门内揭示采用不同节拍。"
      ],
      "判定": "节拍有变化，但短段模板削弱差异。"
    }
  },
  "九维风险": {
    "叙事结构": {
      "分数": 1.05,
      "证据": [
        "主要事件围绕黑钥匙与第三扇门集中推进。"
      ],
      "判定": "低风险。"
    },
    "文风语言": {
      "分数": 1.9,
      "证据": [
        "连续使用“不是……是……”和超短段。"
      ],
      "判定": "主要修复区是节奏模板。"
    },
    "创意设定": {
      "分数": 1.1,
      "证据": [
        "死两次、三扇门、双韩照骨形成组合设定。"
      ],
      "判定": "母题熟悉但组合有辨识度。"
    },
    "角色心理": {
      "分数": 1.7,
      "证据": [
        "陆沉舟判断清楚，宁小满目前偏功能化。"
      ],
      "判定": "主角成立，配角立场仍需展开。"
    },
    "技术连续性": {
      "分数": 0.4,
      "证据": [
        "钥匙、药叶、钟声和疼痛均前后继承。"
      ],
      "判定": "章内连续性稳定。"
    },
    "阅读体验": {
      "分数": 0.75,
      "证据": [
        "开篇异常、追逐和章末钩子均清楚。"
      ],
      "判定": "可读性风险低。"
    },
    "概率趋同": {
      "分数": 1.7,
      "证据": [
        "神秘遗物—追捕—异空间属于熟悉路径。"
      ],
      "判定": "存在类型趋同，但局部组合有变化。"
    },
    "肉身经验缺失": {
      "分数": 0.65,
      "证据": [
        "疼痛落在肋骨、脊背、左腿、脚踝和掌心。"
      ],
      "判定": "身体经验较充分。"
    },
    "留白不足": {
      "分数": 1.05,
      "证据": [
        "双韩照骨和三扇门保留谜面，但局部推断说满。"
      ],
      "判定": "整体留白成立，局部需收缩解释。"
    }
  },
  "AI参与反向证据": {
    "长程回收": {
      "分数": 2.4,
      "证据": [
        "钟声、钥匙与第三扇门在章内形成回环。"
      ],
      "判定": "存在结构回收，但仅有单章证据。"
    },
    "人物声纹": {
      "分数": 1.9,
      "证据": [
        "陆沉舟冷静判断稳定，宁小满和韩照骨区分尚有限。"
      ],
      "判定": "人物声纹中等。"
    },
    "功能性不对称": {
      "分数": 2.5,
      "证据": [
        "钥匙既推进逃亡又导入身体记忆和灭门历史。"
      ],
      "判定": "细节承担不对称复合功能。"
    }
  },
  "AI伪概率不确定度": {
    "正文汉字数": 2339,
    "评审分歧": 0.25,
    "缺同类型基线": true,
    "疑似深度人机混编": true
  }
}